id,text,aspect,sentiment
2339_0,I charge it at night and skip taking the cord with me because of the good battery life.,cord,neutral
2339_1,I charge it at night and skip taking the cord with me because of the good battery life.,battery life,positive
1316_0,"The tech guy then said the service center does not do 1-to-1 exchange and I have to direct my concern to the ""sales"" team, which is the retail shop which I bought my netbook from.",service center,negative
1316_1,"The tech guy then said the service center does not do 1-to-1 exchange and I have to direct my concern to the ""sales"" team, which is the retail shop which I bought my netbook from.","""sales"" team",negative
1316_2,"The tech guy then said the service center does not do 1-to-1 exchange and I have to direct my concern to the ""sales"" team, which is the retail shop which I bought my netbook from.",tech guy,neutral
2005_0,"it is of high quality, has a killer GUI, is extremely stable, is highly expandable, is bundled with lots of very good applications, is easy to use, and is absolutely gorgeous.",quality,positive
2005_1,"it is of high quality, has a killer GUI, is extremely stable, is highly expandable, is bundled with lots of very good applications, is easy to use, and is absolutely gorgeous.",GUI,positive
2005_2,"it is of high quality, has a killer GUI, is extremely stable, is highly expandable, is bundled with lots of very good applications, is easy to use, and is absolutely gorgeous.",applications,positive
2005_3,"it is of high quality, has a killer GUI, is extremely stable, is highly expandable, is bundled with lots of very good applications, is easy to use, and is absolutely gorgeous.",use,positive
2789_0,Easy to start up and does not overheat as much as other laptops.,start up,positive
76_0,"I even got my teenage son one, because of the features that it offers, like, iChat, Photobooth, garage band and more!",features,positive
76_1,"I even got my teenage son one, because of the features that it offers, like, iChat, Photobooth, garage band and more!",iChat,positive
76_2,"I even got my teenage son one, because of the features that it offers, like, iChat, Photobooth, garage band and more!",Photobooth,positive
76_3,"I even got my teenage son one, because of the features that it offers, like, iChat, Photobooth, garage band and more!",garage band,positive
80_0,Great laptop that offers many great features!,features,positive
917_0," One night I turned the freaking thing off after using it, the next day I turn it on, no GUI, screen all dark, power light steady, hard drive light steady and not flashing as it usually does.",GUI,negative
917_1," One night I turned the freaking thing off after using it, the next day I turn it on, no GUI, screen all dark, power light steady, hard drive light steady and not flashing as it usually does.",screen,negative
917_2," One night I turned the freaking thing off after using it, the next day I turn it on, no GUI, screen all dark, power light steady, hard drive light steady and not flashing as it usually does.",power light,neutral
917_3," One night I turned the freaking thing off after using it, the next day I turn it on, no GUI, screen all dark, power light steady, hard drive light steady and not flashing as it usually does.",hard drive light,negative
1630_0,I took it back for an Asus and same thing- blue screen which required me to remove the battery to reset.,battery,neutral
38_0,"In the shop, these MacBooks are encased in a soft rubber enclosure - so you will never know about the razor edge until you buy it, get it home, break the seal and use it (very clever con).",rubber enclosure,positive
38_1,"In the shop, these MacBooks are encased in a soft rubber enclosure - so you will never know about the razor edge until you buy it, get it home, break the seal and use it (very clever con).",edge,negative
337_0,"However, the multi-touch gestures and large tracking area make having an external mouse unnecessary (unless you're gaming).",multi-touch gestures,positive
337_1,"However, the multi-touch gestures and large tracking area make having an external mouse unnecessary (unless you're gaming).",tracking area,positive
337_2,"However, the multi-touch gestures and large tracking area make having an external mouse unnecessary (unless you're gaming).",external mouse,neutral
337_3,"However, the multi-touch gestures and large tracking area make having an external mouse unnecessary (unless you're gaming).",gaming,neutral
2568_0,I love the way the entire suite of software works together.,suite of software,positive
295_0,The speed is incredible and I am more than satisfied.,speed,positive
2759_0,This laptop meets every expectation and Windows 7 is great!,Windows 7,positive
2980_0,I can barely use any usb devices because they will not stay connected properly.,usb devices,negative
743_0,When I finally had everything running with all my software installed I plugged in my droid to recharge and the system crashed.,software,neutral
743_1,When I finally had everything running with all my software installed I plugged in my droid to recharge and the system crashed.,system,negative
2587_0,"One suggestion I do have, is to not bother getting Microsoft office for the mac expecting it will work just like you knew it to on a PC.",Microsoft office for the mac,negative
2202_0,Pairing it with an iPhone is a pure pleasure - talk about painless syncing - used to take me forever - now it's a snap.,syncing,positive
2227_0,"I also got the added bonus of a 30"" HD Monitor, which really helps to extend my screen and keep my eyes fresh!","30"" HD Monitor",positive
2227_1,"I also got the added bonus of a 30"" HD Monitor, which really helps to extend my screen and keep my eyes fresh!",screen,neutral
92_0,The machine is slow to boot up and occasionally crashes completely.,boot up,negative
1204_0,"After paying several hundred dollars for this service, it is frustrating that you cannot get help after hours.",service,negative
1574_0,I love the operating system and the preloaded software.,operating system,positive
1574_1,I love the operating system and the preloaded software.,preloaded software,positive
3073_0,The best thing about this laptop is the price along with some of the newer features.,price,positive
3073_1,The best thing about this laptop is the price along with some of the newer features.,features,positive
1254_0,"After numerous attempts of trying (including setting the clock in BIOS setup directly), I gave up(I am a techie).",clock in BIOS setup,negative
810_0,YOU WILL NOT BE ABLE TO TALK TO AN AMERICAN WARRANTY SERVICE IS OUT OF COUNTRY.,WARRANTY SERVICE,negative
130_0,but now i have realized its a problem with this brand.,brand,negative
839_0,I sent it back to Toshiba twice they covered it under the  warranty.,warranty,positive
696_0,I was looking for a mac which is portable and has all the features that I was looking for.,features,positive
1030_0,Also kinda loud when the fan was running.,fan,negative
1425_0,"In desparation, I called their Customer Service number and was told that my warranty had expired (2 days old) and that the priviledge of talking to a technician would cost me (""have your credit card ready"").",Customer Service number,neutral
1425_1,"In desparation, I called their Customer Service number and was told that my warranty had expired (2 days old) and that the priviledge of talking to a technician would cost me (""have your credit card ready"").",warranty,negative
1425_2,"In desparation, I called their Customer Service number and was told that my warranty had expired (2 days old) and that the priviledge of talking to a technician would cost me (""have your credit card ready"").",talking to a technician,negative
661_0,There also seemed to be a problem with the hard disc as certain times windows loads but claims to not be able to find any drivers or files.,hard disc,negative
661_1,There also seemed to be a problem with the hard disc as certain times windows loads but claims to not be able to find any drivers or files.,windows,negative
661_2,There also seemed to be a problem with the hard disc as certain times windows loads but claims to not be able to find any drivers or files.,drivers,neutral
997_0,Drivers updated ok but the BIOS update froze the system up and the computer shut down.,Drivers,positive
997_1,Drivers updated ok but the BIOS update froze the system up and the computer shut down.,BIOS update,negative
997_2,Drivers updated ok but the BIOS update froze the system up and the computer shut down.,system,negative
463_0,Spent 2 hours on phone with HP Technical Support.,HP Technical Support,neutral
1193_0,"Speaking of the browser, it too has problems.",browser,negative
147_0,The keyboard is too slick.,keyboard,negative
1433_0,Nightly my computer defrags itself and runs a virus scan.,virus scan,neutral
1669_0,"It's like 9 punds, but if you can look past it, it's GREAT!",9 punds,negative
2462_0,It's just as fast with one program open as it is with sixteen open.,program,neutral
2719_0,"Still under warrenty so called Toshiba, no help at all.",warrenty,negative
1224_0,I was happy with My purchase of a Toshiba Satellite L305D-S5934 laptop until it came time to have it repaired under the Toshiba Warranty.,Toshiba Warranty,negative
2492_0,Amazing Quality!,Quality,positive
1541_0,The fact that you can spend over $100 on just a webcam underscores the value of this machine.,webcam,neutral
1541_1,The fact that you can spend over $100 on just a webcam underscores the value of this machine.,value,positive
3060_0,"I mainly use it for email, internet, and managing personal files (pics, vids, etc.).",internet,neutral
3060_1,"I mainly use it for email, internet, and managing personal files (pics, vids, etc.).",managing personal files,neutral
915_0,"A month or so ago, the freaking motherboard just died.",motherboard,negative
2050_0,"The system it comes with does not work properly, so when trying to fix the problems with it it started not working at all.",system,negative
460_0,Then after 4 or so months the charger stopped working so I was forced to go out and buy new hardware just to keep this computer running.,charger,negative
460_1,Then after 4 or so months the charger stopped working so I was forced to go out and buy new hardware just to keep this computer running.,hardware,negative
1524_0,"If a website ever freezes (which is rare), its really easy to force quit.",force quit,positive
803_0,It rarely works and when it does it's incredibly slow.,works,negative
2225_0,I also enjoy the fact that my MacBook Pro laptop allows me to run Windows 7 on it by using the VMWare program.,Windows 7,positive
2225_1,I also enjoy the fact that my MacBook Pro laptop allows me to run Windows 7 on it by using the VMWare program.,VMWare program,neutral
2644_0,"It's so much easier to navigate through the operating system, to find files, and it runs a lot faster!",operating system,positive
2644_1,"It's so much easier to navigate through the operating system, to find files, and it runs a lot faster!",runs,positive
2644_2,"It's so much easier to navigate through the operating system, to find files, and it runs a lot faster!",navigate,positive
2644_3,"It's so much easier to navigate through the operating system, to find files, and it runs a lot faster!",find files,positive
1365_0,Purchased a Toshiba Lap top it worked good until just after the warrenty went out.,warrenty,negative
2033_0,"I wanted to purchase the extended warranty and they refused, because they knew it was trouble.",extended warranty,neutral
2271_0,We upgraded the memory to four gigabytes in order to take advantage of the performace increase in speed.,memory,neutral
2271_1,We upgraded the memory to four gigabytes in order to take advantage of the performace increase in speed.,speed,positive
2271_2,We upgraded the memory to four gigabytes in order to take advantage of the performace increase in speed.,performace,positive
103_0,"The reality was, it heated up very quickly, and took way too long to do simple things, like opening my Documents folder.",opening my Documents folder,negative
1149_0,I had always used PCs and been constantly frustrated by the crashing and the poorly designed operating systems that were never very intuitive.,operating systems,negative
900_0,"Then, within 5 months, the charger crapped out on me.",charger,negative
1649_0,And if you have a iphone or ipod touch you can connect and download songs to it at high speed.,speed,positive
446_0,I love the glass touchpad.,glass touchpad,positive
1912_0,  I continued to take the computer in AGAIN and they replaced the hard drive and mother board yet again.,hard drive,negative
1912_1,  I continued to take the computer in AGAIN and they replaced the hard drive and mother board yet again.,mother board,negative
2752_0,I am using the external speaker- sound is good.,external speaker,positive
2752_1,I am using the external speaker- sound is good.,sound,positive
2381_0,"still testing the battery life as i thought it would be better, but am very happy with the upgrade.",battery life,negative
404_0,"Then HP sends it back to me with the hardware screwed up, not able to connect.",hardware,negative
407_0,"Oh yeah, don't forget the expensive shipping to and from HP.",shipping,negative
1731_0,"Everything is so easy to use, Mac software is just so much simpler than Microsoft software.",Mac software,positive
1731_1,"Everything is so easy to use, Mac software is just so much simpler than Microsoft software.",Microsoft software,negative
1731_2,"Everything is so easy to use, Mac software is just so much simpler than Microsoft software.",use,positive
1186_0,"And if you do a lot of writing, editing is a problem since there is no  forward delete  key.",delete  key,negative
1186_1,"And if you do a lot of writing, editing is a problem since there is no  forward delete  key.",editing,negative
2470_0,Its ease of use and the top service from Apple- be it their phone assistance or bellying up to the genius bar- cannot be beat.,use,positive
2470_1,Its ease of use and the top service from Apple- be it their phone assistance or bellying up to the genius bar- cannot be beat.,service,positive
2470_2,Its ease of use and the top service from Apple- be it their phone assistance or bellying up to the genius bar- cannot be beat.,phone assistance,positive
2470_3,Its ease of use and the top service from Apple- be it their phone assistance or bellying up to the genius bar- cannot be beat.,genius bar,positive
331_0,"It has a 10 hour battery life when you're doing web browsing and word editing, making it perfect for the classroom or office, and in terms of gaming and movie playing it'll have a battery life of just over 5 hours.",battery life,positive
331_1,"It has a 10 hour battery life when you're doing web browsing and word editing, making it perfect for the classroom or office, and in terms of gaming and movie playing it'll have a battery life of just over 5 hours.",battery life,positive
331_2,"It has a 10 hour battery life when you're doing web browsing and word editing, making it perfect for the classroom or office, and in terms of gaming and movie playing it'll have a battery life of just over 5 hours.",gaming,neutral
331_3,"It has a 10 hour battery life when you're doing web browsing and word editing, making it perfect for the classroom or office, and in terms of gaming and movie playing it'll have a battery life of just over 5 hours.",movie playing,neutral
331_4,"It has a 10 hour battery life when you're doing web browsing and word editing, making it perfect for the classroom or office, and in terms of gaming and movie playing it'll have a battery life of just over 5 hours.",web browsing,neutral
331_5,"It has a 10 hour battery life when you're doing web browsing and word editing, making it perfect for the classroom or office, and in terms of gaming and movie playing it'll have a battery life of just over 5 hours.",word editing,neutral
1057_0,"Acer has set me up with FREE recovery discs, when they are available since I asked.",recovery discs,positive
1095_0,"I also purchased Office Max's ""Max Assurance"" with the ""no lemon"" clause.","Office Max's ""Max Assurance""",neutral
1718_0,I eventually did the migration from my iMac backup disc which uses USB.,iMac backup disc,neutral
1718_1,I eventually did the migration from my iMac backup disc which uses USB.,USB,neutral
2923_0,"The battery life seems to be very good, and have had no issues with it.",battery life,positive
3027_0,Enabling the battery timer is useless.,battery timer,negative
654_0,Temperatures on the outside were alright but i did not track in Core Processing Unit temperatures.,Temperatures,neutral
654_1,Temperatures on the outside were alright but i did not track in Core Processing Unit temperatures.,Core Processing Unit temperatures,neutral
1110_0,Going to bring it to service today.,service,neutral
1488_0,"There is no need to purchase virus protection for Mac, which saves me a lot of time and money.",virus protection for Mac,positive
488_0,"But we had paid for bluetooth, and there was none.",bluetooth,negative
1289_0,"So, I paid a visit to LG notebook service center at Alexandra Road, hoping they can make the hinge tighter.",LG notebook service center,neutral
1289_1,"So, I paid a visit to LG notebook service center at Alexandra Road, hoping they can make the hinge tighter.",hinge,negative
2985_0,"My daughter uses it for games, email, facebook, pictures and music.",games,neutral
1573_0,"It is always reliable, never bugged and responds well.",responds,positive
1928_0,After about a week I finally got it back and was told that the motherboard had failed and so they installed a new motherboard.,motherboard,negative
1928_1,After about a week I finally got it back and was told that the motherboard had failed and so they installed a new motherboard.,motherboard,neutral
1099_0,"It was slow, locked up, and also had hardware replaced after only 2 months!",hardware,negative
1347_0,they had to replace the motherboard in April,motherboard,negative
1408_0,"Yes, the computer was light weight, less expensive than the average laptop, and was pretty self explantory in use.",use,positive
1374_0,"Also, if you need to talk to a representive at Microsoft, there is a charge, which I believe is robbery, since you are charged enormous amounts for a very badly designed system, which most people would have went with XP if they could.",representive at Microsoft,negative
1374_1,"Also, if you need to talk to a representive at Microsoft, there is a charge, which I believe is robbery, since you are charged enormous amounts for a very badly designed system, which most people would have went with XP if they could.",system,negative
1374_2,"Also, if you need to talk to a representive at Microsoft, there is a charge, which I believe is robbery, since you are charged enormous amounts for a very badly designed system, which most people would have went with XP if they could.",XP,positive
2864_0,I love WIndows 7 which is a vast improvment over Vista.,WIndows 7,positive
2864_1,I love WIndows 7 which is a vast improvment over Vista.,Vista,negative
30_0,"Keyboard is great, very quiet for all the typing that I do.",Keyboard,positive
474_0,Dell's customer disservice is an insult to it's customers who pay good money for shoddy products.,Dell's customer disservice,negative
156_0,"It had a cooling system malfunction after 10 minutes of general use, and would not move past this error.",cooling system,negative
156_1,"It had a cooling system malfunction after 10 minutes of general use, and would not move past this error.",use,neutral
2095_0,"I can render AVCHD movies with little effort, which was a problem for most pc's unless you had a quad core I7.",quad core I7,positive
1722_0,"After talking it over with the very knowledgeable sales associate, I chose the MacBook Pro over the white MacBook.",sales associate,positive
2004_0,"If you really want a bang-up system and don't need to run Windows applications, go with an Apple;",system,positive
2004_1,"If you really want a bang-up system and don't need to run Windows applications, go with an Apple;",Windows applications,neutral
2296_0,You won't have to spend gobs of money on some inefficient virus program that needs to be updated every month and that constantly drains your wallet.,virus program,negative
493_0,It weighed like seven pounds or something like that.,weighed,neutral
493_1,It weighed like seven pounds or something like that.,seven pounds,neutral
902_0,"2 months later, the battery went.",battery,negative
2433_0,You may need to special order a bag.,bag,neutral
1675_0,It's color is even cool.,color,positive
609_0,keys are all in weird places and is way too large for the way it is designed.,keys,negative
609_1,keys are all in weird places and is way too large for the way it is designed.,designed,negative
296_0,"Yes, a Mac is much more money than the average laptop out there, but there is no comparison in style, speed and just cool factor.",style,positive
296_1,"Yes, a Mac is much more money than the average laptop out there, but there is no comparison in style, speed and just cool factor.",speed,positive
2335_0,The keyboard feels good and I type just fine on it.,keyboard,positive
2416_0,I thought the white Mac computers looked dirty too quicly where you use the mousepad and where you place your hands when typing.,mousepad,neutral
1471_0,"And not to mention after using it for a few months or so, the battery will slowly less and less hold a charge until you can't leave it unplugged for more than 5 minutes without the thing dying.",battery,negative
1427_0,"BEST BUY - 5 STARS + + + (sales, service, respect for old men who aren't familiar with the technology) DELL COMPUTERS - 3 stars DELL SUPPORT - owes a me a couple",sales,positive
1427_1,"BEST BUY - 5 STARS + + + (sales, service, respect for old men who aren't familiar with the technology) DELL COMPUTERS - 3 stars DELL SUPPORT - owes a me a couple",service,positive
1427_2,"BEST BUY - 5 STARS + + + (sales, service, respect for old men who aren't familiar with the technology) DELL COMPUTERS - 3 stars DELL SUPPORT - owes a me a couple",DELL SUPPORT,positive
911_0,"no complaints with their desktop, and maybe because it just sits on your desktop, and you don't carry it around, which could jar the hard drive, or the motherboard.",hard drive,neutral
911_1,"no complaints with their desktop, and maybe because it just sits on your desktop, and you don't carry it around, which could jar the hard drive, or the motherboard.",motherboard,neutral
2001_0,"Yes, they cost more, but they more than make up for it in speed, construction quality, and longevity.",speed,positive
2001_1,"Yes, they cost more, but they more than make up for it in speed, construction quality, and longevity.",construction quality,positive
2001_2,"Yes, they cost more, but they more than make up for it in speed, construction quality, and longevity.",longevity,positive
2465_0,"Since I keyboard over 100 wpm, I look for a unit that has a comfortble keyboard (no keys sticking or lagging, strange configuration of ""extra key"", etc.",keyboard,positive
2465_1,"Since I keyboard over 100 wpm, I look for a unit that has a comfortble keyboard (no keys sticking or lagging, strange configuration of ""extra key"", etc.",keys,positive
2465_2,"Since I keyboard over 100 wpm, I look for a unit that has a comfortble keyboard (no keys sticking or lagging, strange configuration of ""extra key"", etc.","configuration of ""extra key""",positive
2331_0,) I also tried the touch pad and compared it to other netbooks in the store.,touch pad,neutral
599_0,"It absolutely is more expensive than most PC laptops, but the ease of use, security, and minimal problems that have arisen make it well worth the pricetag.",use,positive
599_1,"It absolutely is more expensive than most PC laptops, but the ease of use, security, and minimal problems that have arisen make it well worth the pricetag.",security,positive
823_0,"  It gets stuck all of the time you use it, and you have to keep tapping on it to get it to work.",use,negative
823_1,"  It gets stuck all of the time you use it, and you have to keep tapping on it to get it to work.",work,negative
3006_0,lots of preloaded software.,preloaded software,positive
2941_0,"I wish it had a webcam though, then it would be perfect!",webcam,negative
2776_0,My favorite part of this computer is that it has a vga port so I can connect it to a bigger screen.,vga port,positive
2776_1,My favorite part of this computer is that it has a vga port so I can connect it to a bigger screen.,screen,neutral
1686_0,Another thing I might add is the battery life is excellent.,battery life,positive
2091_0,"One drawback, I wish the keys were backlit.",keys,negative
1259_0,"Acer was no help and Garmin could not determine the problem(after spending about 2 hours with me), so I returned it and purchased a Toshiba R700 that seems even nicer and I was able to load all of my software with no problem.",software,positive
2938_0,I wish the volume could be louder and the mouse didnt break after only a month.,volume,negative
2938_1,I wish the volume could be louder and the mouse didnt break after only a month.,mouse,negative
2574_0,"I play a lot of casual games online, and the touchpad is very responsive.",touchpad,positive
2351_0,"Granted, it's still a very new laptop but in comparison to my previous laptops and desktops, my Mac boots up noticeably quicker.",boots up,positive
526_0,It caught a virus that completely wiped out my hard drive in a matter of hours.,hard drive,negative
3020_0,"It is everything I'd hoped it would be from a look and feel standpoint, but somehow a bit more sturdy.",look and feel standpoint,positive
2541_0,the only fact i dont like about apples is they generally use safari and i dont use safari but after i install Mozzilla firfox i love every single bit about it.,safari,negative
