id,text,aspect,sentiment
1768_0,Iphoto is great for adding pictures right to facebook and other social networking sites.,Iphoto,positive
1936_0,"In early May I got it back and this time I only had it back for 1 day before it had a NEW issue so it was sent back in for the 6th time they ""expedited"" the repairs so I was only supposed to have to be without it for 3 days and it was supposed to be fixed, by a ""Senior Tech"".",Senior Tech,negative
2859_0,"Some features arent friendly ( volume wheel, sound quality, etc.",volume wheel,negative
2859_1,"Some features arent friendly ( volume wheel, sound quality, etc.",sound quality,negative
2859_2,"Some features arent friendly ( volume wheel, sound quality, etc.",features,negative
2745_0,"A cheaper price should not equal a ""cheap"" product.",price,positive
2489_0,"I think the manual is somewhere on the hard drive, but I rather have a hard copy.",manual,neutral
2489_1,"I think the manual is somewhere on the hard drive, but I rather have a hard copy.",hard drive,neutral
2203_0,Thank you Best Buy for putting my computer together and installing my first software - you guys were GREAT too!,software,neutral
1053_0,Adjust the sensitivity since it's not that responsive to begin with.,sensitivity,negative
593_1,"After a couple of years, my battery life began to diminish but was replaced for free due to a company-wide recall of my particular battery.",battery,negative
354_0,"The system constantly overheats, the battery life is too short, the case is coming apart, and my core applications that I use every day in my work as a graphic artist run poorly.",battery life,negative
354_1,"The system constantly overheats, the battery life is too short, the case is coming apart, and my core applications that I use every day in my work as a graphic artist run poorly.",case,negative
354_2,"The system constantly overheats, the battery life is too short, the case is coming apart, and my core applications that I use every day in my work as a graphic artist run poorly.",core applications,negative
354_3,"The system constantly overheats, the battery life is too short, the case is coming apart, and my core applications that I use every day in my work as a graphic artist run poorly.",system,negative
2010_0,  Later it held zero charge and its replacement worked for less than three months.,charge,negative
950_0,  The company sent me a whole new cord overnight and apologized.,cord,positive
2761_0,It's even easy to hook up to other wireless networks.,hook up to other wireless networks,positive
822_0,"  Also, I have had alot of trouble with the shift key to go to other lines.",shift key,negative
771_0,"The rep did not even answer my question, I had to ask him, if he understood what I ask or if he spoke english because he didn't even try to acknowledge my question.",rep,negative
577_0,It gives me the power and speed that I need to run all the programs I use to edit.,power,positive
577_1,It gives me the power and speed that I need to run all the programs I use to edit.,speed,positive
577_2,It gives me the power and speed that I need to run all the programs I use to edit.,programs,neutral
2247_0,iLife is easily compatible with Microsoft Office so you can send and receive files from a PC.,iLife,positive
2247_1,iLife is easily compatible with Microsoft Office so you can send and receive files from a PC.,Microsoft Office,neutral
2267_0,"As a computer science student in college, I find that the portability, longevity, and ease of use of this computer make me (shockingly) want to do homework more;",portability,positive
2267_1,"As a computer science student in college, I find that the portability, longevity, and ease of use of this computer make me (shockingly) want to do homework more;",longevity,positive
2267_2,"As a computer science student in college, I find that the portability, longevity, and ease of use of this computer make me (shockingly) want to do homework more;",use,positive
945_0,  Again I sent it back and they replaced the motherboard and some fan inside.,motherboard,neutral
945_1,  Again I sent it back and they replaced the motherboard and some fan inside.,fan,neutral
2160_0,"Fully charged, the MacBook Pro can last about five hours unplugged.",charged,positive
290_0,"I know there are way better laptops out there for the same price, and why spend money on shit when you can go out and get yourself a perfectly decent laptop that doesnt suck total monkey balls.",price,neutral
1467_0,"For me, keys were starting to get stuck and wouldn't type very well.",keys,negative
608_0,can't reinstall with standard os cd because of proprietary hardware drivers.,standard os cd,negative
608_1,can't reinstall with standard os cd because of proprietary hardware drivers.,proprietary hardware drivers,negative
255_0,"There is a small red circle next to it with a x in the middle, and when I click on it it says: "" Consider replacing your battery"" and it does not hold full charge.",battery,neutral
255_1,"There is a small red circle next to it with a x in the middle, and when I click on it it says: "" Consider replacing your battery"" and it does not hold full charge.",charge,negative
395_0,The computer was two weeks late in delivery because HP forgot to complete the required import paperwork.,delivery,negative
1104_0,The first programm I switched on was a game for my children.,programm,neutral
2922_0,I have been very pleased with the performance of this laptop.,performance,positive
2398_0,"I bought it for my mom and she reports that the battery life lasts all day for her, it's very lightweight, and the response for the computing she's doing (Internet focused activity: mail, research, etc.) is excellent;",battery life,positive
2398_1,"I bought it for my mom and she reports that the battery life lasts all day for her, it's very lightweight, and the response for the computing she's doing (Internet focused activity: mail, research, etc.) is excellent;",response,positive
2398_2,"I bought it for my mom and she reports that the battery life lasts all day for her, it's very lightweight, and the response for the computing she's doing (Internet focused activity: mail, research, etc.) is excellent;",Internet focused activity,neutral
2581_0,Its very nice and once you learn the features you will be so happy to have such a sophisticated computer.,features,neutral
1766_0,It is sleek and lightweight and charges quickly when needed.,charges,positive
2236_0,"also you may need to charge it once a day, if for medium use every thing fast and easy with mac  the size and look is the most feature that attracted me to it.",size,positive
2236_1,"also you may need to charge it once a day, if for medium use every thing fast and easy with mac  the size and look is the most feature that attracted me to it.",look,positive
2236_2,"also you may need to charge it once a day, if for medium use every thing fast and easy with mac  the size and look is the most feature that attracted me to it.",feature,positive
2236_3,"also you may need to charge it once a day, if for medium use every thing fast and easy with mac  the size and look is the most feature that attracted me to it.",charge,neutral
1717_0,( The iBook backup also uses a firewire connection).,iBook backup,neutral
1717_1,( The iBook backup also uses a firewire connection).,firewire connection,neutral
2766_0,"I did think it had a camera because that was one of my requirements, but forgot to check in the specifications on this one before I purchased.",camera,neutral
2766_1,"I did think it had a camera because that was one of my requirements, but forgot to check in the specifications on this one before I purchased.",specifications,neutral
448_0,Also the display is exceptional!,display,positive
1225_0,The computer was shipped to their repair depot  on june 24 and returned on July 2 seems like a short turn around time except the computer was not repaired when it was returned.,repair depot,neutral
207_0,Learning all of the keyboard shortcuts only took a few minutes to get used to as some of the shortcuts are the same on Windows machines.,keyboard shortcuts,positive
207_1,Learning all of the keyboard shortcuts only took a few minutes to get used to as some of the shortcuts are the same on Windows machines.,shortcuts,neutral
2805_0,little short on RAM but you get what you pay for.,RAM,negative
1819_0,"It didn't come with any software installed outside of windows media, but for the price, I was very pleased with the condition and the overall product.",software,negative
1819_1,"It didn't come with any software installed outside of windows media, but for the price, I was very pleased with the condition and the overall product.",windows media,neutral
1819_2,"It didn't come with any software installed outside of windows media, but for the price, I was very pleased with the condition and the overall product.",price,positive
904_0,"THEN, one month after the warranty expired, the replacement charger went.",warranty,neutral
904_1,"THEN, one month after the warranty expired, the replacement charger went.",replacement charger,negative
2093_0,"I love a ""pc"" but I was ready for a change and tired of the windows system.",windows system,negative
890_0,"Your cursor will end up all over the freaking place,,,it's not uncommon for me to accidentally delete words, sentences, paragraphs because of this mousepad.",cursor,negative
890_1,"Your cursor will end up all over the freaking place,,,it's not uncommon for me to accidentally delete words, sentences, paragraphs because of this mousepad.",mousepad,negative
722_0,"Other installed features, such as certain printer software, are also most attractive.",features,positive
722_1,"Other installed features, such as certain printer software, are also most attractive.",printer software,positive
575_0,"I work in film editing and post production, so I need a laptop that not only has power, but memory and speed as well.",power,neutral
575_1,"I work in film editing and post production, so I need a laptop that not only has power, but memory and speed as well.",memory,neutral
575_2,"I work in film editing and post production, so I need a laptop that not only has power, but memory and speed as well.",speed,neutral
1310_0,"Even doing so, the hinge may just be slightly tightened only.",hinge,neutral
1570_0,"company provides UPS shipping, fast, great!",shipping,positive
1020_0,I would tell the technician I knew exactly what was wrong with it but they did not listen and I had to go through a bunch of junk to get them to tell me I needed to send the computer in.,technician,negative
982_0,"  Then I've fixed the DC jack (inside the unit), rewired the DC jack to the OUTside of the laptop, replaced the power brick.",DC jack,neutral
982_1,"  Then I've fixed the DC jack (inside the unit), rewired the DC jack to the OUTside of the laptop, replaced the power brick.",DC jack,neutral
982_2,"  Then I've fixed the DC jack (inside the unit), rewired the DC jack to the OUTside of the laptop, replaced the power brick.",power brick,neutral
1783_0,"It is easy to use, has great screen quality, and every so light weight.",screen quality,positive
1783_1,"It is easy to use, has great screen quality, and every so light weight.",use,positive
2090_0,"Great product, very easy to use and great graphics.",graphics,positive
2090_1,"Great product, very easy to use and great graphics.",use,positive
597_0,The iLife software that comes with the computer is so simple to use and produces a great finished product.,iLife software,positive
597_1,The iLife software that comes with the computer is so simple to use and produces a great finished product.,use,positive
454_0,The built-in webcam is great for Skype and similar video-chat services.,built-in webcam,positive
1321_0,The shop will definitely push the problem to the service center.,service center,neutral
2507_0,"PC users work in Word, while Mac users work in Pages.",Word,neutral
2507_1,"PC users work in Word, while Mac users work in Pages.",Pages,neutral
84_0,"While I mostly use it for email, internet and gaming, I'm confident all other applications live up to the high standard I've come to appreciate from Mac laptops.",applications,positive
84_1,"While I mostly use it for email, internet and gaming, I'm confident all other applications live up to the high standard I've come to appreciate from Mac laptops.",internet,neutral
84_2,"While I mostly use it for email, internet and gaming, I'm confident all other applications live up to the high standard I've come to appreciate from Mac laptops.",gaming,neutral
834_0,"This laptop looks great on the surface: 17"" inch screen, good  price-point, nice appearance, boots up quickly, runs fast etc.","17"" inch screen",positive
834_1,"This laptop looks great on the surface: 17"" inch screen, good  price-point, nice appearance, boots up quickly, runs fast etc.",price-point,positive
834_2,"This laptop looks great on the surface: 17"" inch screen, good  price-point, nice appearance, boots up quickly, runs fast etc.",appearance,positive
834_3,"This laptop looks great on the surface: 17"" inch screen, good  price-point, nice appearance, boots up quickly, runs fast etc.",boots up,positive
834_4,"This laptop looks great on the surface: 17"" inch screen, good  price-point, nice appearance, boots up quickly, runs fast etc.",runs,positive
1449_0,"The apple systems are over priced luxurys that arn't worth what they are being charged for, this model's specifications are far from being impressive and they only thing you get out of this is the apple name.",specifications,negative
566_0,pros:  the macbook pro notebook has a large battery life and you wont have to worry to charge your laptop every five hours or so.,battery life,positive
983_0,Disappointing for such a lovely screen and at a reasonable price,screen,positive
983_1,Disappointing for such a lovely screen and at a reasonable price,price,positive
2975_0,The only bad thing about it is they give you the worst batteries possible.,batteries,negative
2684_0,Good price.,price,positive
918_0, THE MOTHERBOARD IS DEAD !,MOTHERBOARD,negative
2144_0,the speed is fine.,speed,positive
1361_0,Hmmm - that high failure rate sure isn't reflected in the retail price.,retail price,negative
2784_0,"It was not clear that the Microsoft Student Edition that was loaded on the computer, was a six month trial.",Microsoft Student Edition,negative
1805_0,Good for every day computing and web browsing.,web browsing,positive
1805_1,Good for every day computing and web browsing.,every day computing,positive
821_0,"  Also, I have had alot of trouble with the keys sticking and will not type correctly.",keys,negative
441_0,Excellent LED monitor and well equipped.,LED monitor,positive
1913_0,  This process continued to repeat itself until the mother board had been replaced 4 times and the hard drive replaced 3 times.,mother board,negative
1913_1,  This process continued to repeat itself until the mother board had been replaced 4 times and the hard drive replaced 3 times.,hard drive,negative
1793_0,"Without a doubt, the *design* of this laptop is fantastic.",design,positive
378_0,I couldn't believe how long the battery lasted on a single charge.,battery,positive
378_1,I couldn't believe how long the battery lasted on a single charge.,charge,positive
1412_0,I could save ten essay papers and have hardly any memory left.,memory,negative
2963_0,"Other than that, I would recommend this to someone in need of a cheap laptop with semi-decent gaming capabilities.",gaming,positive
568_0,"This is the first time that I tried and owning a netbook although I have used 3 different laptops in the past 10 years, I find not much difference except of course for the screen size.",screen size,neutral
1202_0,But the biggest pain is that tech support is not available 24/7.,tech support,negative
1491_0,The backlit keys are wonderful when you are working in the dark.,backlit keys,positive
1171_0,"I chose the iBookG4, a laptop that is an attractive computer with a large screen big enough to please anyone.",screen,positive
1727_0,"The most recent being that my Safari internet browser is freaking out on me, but I have just been using firefox instead.",Safari internet browser,negative
1727_1,"The most recent being that my Safari internet browser is freaking out on me, but I have just been using firefox instead.",firefox,positive
2503_0,"Everything about the Mac is not only visually appealing, but very easy to use.",use,positive
3031_0,I know what 7 hrs of battery looks like.,battery,positive
2970_0,I did not have to call the support line at all.,support line,neutral
1483_0,The laptop is outstanding in all aspects except that it has the Windows 7 starter and not the full Windows 7.,Windows 7 starter,negative
1483_1,The laptop is outstanding in all aspects except that it has the Windows 7 starter and not the full Windows 7.,Windows 7,positive
1084_0,THE FIRST PROBLEM IS THAT THE KEYBOARD FUNCTION IS SIMPLY UNSATISFACTORY.,KEYBOARD FUNCTION,negative
120_0,"The DVD drive randomly pops open when it is in my backpack as well, which is annoying.",DVD drive,negative
1658_0,"Garageband is more for the musicians, and the laptop is equipped with a good working microphone, good enough for beginners and musicians at the intermediate level.",Garageband,neutral
1658_1,"Garageband is more for the musicians, and the laptop is equipped with a good working microphone, good enough for beginners and musicians at the intermediate level.",microphone,positive
3004_0,I dual boot with Linux and that other security-prone OS and it performs flawlessly.,Linux,neutral
3004_1,I dual boot with Linux and that other security-prone OS and it performs flawlessly.,security-prone OS,neutral
3004_2,I dual boot with Linux and that other security-prone OS and it performs flawlessly.,performs,positive
2894_0,The difference is the Toshiba had a lot more memory and hard drive space.,memory,positive
2894_1,The difference is the Toshiba had a lot more memory and hard drive space.,hard drive space,positive
1716_0,There was a little difficulty doing the migration as the firewire cable system can't be used with the iBook.,firewire cable system,negative
1716_1,There was a little difficulty doing the migration as the firewire cable system can't be used with the iBook.,iBook,neutral
2734_0,Seems like maybe a bad shipment from Toshiba.,shipment,negative
2315_0,OS X is solid with lots of innovations such as quicklook which save heaps of time.,OS X,positive
2315_1,OS X is solid with lots of innovations such as quicklook which save heaps of time.,quicklook,positive
1567_0,But other than that I am blown away by all the features this laptop offers.,features,positive
387_0,The keyboard is slick and quiet and not bulky like some other laptops I have had in the past.,keyboard,positive
8_0,"Overall, this laptop is definitely a keeper with its simple yet stylish design and its array of fantastic colors to choose from.",design,positive
8_1,"Overall, this laptop is definitely a keeper with its simple yet stylish design and its array of fantastic colors to choose from.",colors,positive
403_0,First the screen goes completely out.,screen,negative
2350_0,I'm learning the finger options for the mousepad that allow for quicker browsing of web pages.,mousepad,positive
2350_1,I'm learning the finger options for the mousepad that allow for quicker browsing of web pages.,browsing,positive
1497_0,"The PhotoBooth is a great program, it takes very good pictures with the built-in camera.",PhotoBooth,positive
1497_1,"The PhotoBooth is a great program, it takes very good pictures with the built-in camera.",program,positive
1497_2,"The PhotoBooth is a great program, it takes very good pictures with the built-in camera.",built-in camera,positive
280_0,Many kinds of software that is necessary to the working person is not available and cannot be downloaded.,software,negative
1012_0,I had to pay for the shipping!,shipping,negative
657_0,"It bluescreened on me without any warning, running simply basic Chrome.",Chrome,negative
2764_0,I took 3-4 years researching brands and prices of laptops.,prices,neutral
2149_0,We researched and found the best price at MacConnection.,price,positive
926_0,But guess what?  (you have to buy an external dvd drive it doesn't have a built in type) The notebook can't be used because it doesn't read anything for an external drive.,external dvd drive,negative
926_1,But guess what?  (you have to buy an external dvd drive it doesn't have a built in type) The notebook can't be used because it doesn't read anything for an external drive.,external drive,negative
682_0,GET THIS COMPUTER FOR PORTABILITY AND FAST PROCESSING!!!,PORTABILITY,positive
682_1,GET THIS COMPUTER FOR PORTABILITY AND FAST PROCESSING!!!,PROCESSING,positive
871_0,I use a cooling pad but it doesn't help.,cooling pad,negative
1744_0,Supplied software: The software that comes with this machine is greatly welcomed compared to what Windows comes with.,Supplied software,neutral
1744_1,Supplied software: The software that comes with this machine is greatly welcomed compared to what Windows comes with.,software,positive
1744_2,Supplied software: The software that comes with this machine is greatly welcomed compared to what Windows comes with.,Windows,negative
773_0,I'm tired of the inept service.,service,negative
1659_0,"Garageband is easy to work with, like all the other apple applications I've had experience with.",Garageband,positive
1659_1,"Garageband is easy to work with, like all the other apple applications I've had experience with.",apple applications,positive
746_0,"No, tey don't even support their own bios and it ""could be a problem with the bios"" How can a company that makes a fairly decent product get away with such insanity??!!",bios,negative
746_1,"No, tey don't even support their own bios and it ""could be a problem with the bios"" How can a company that makes a fairly decent product get away with such insanity??!!",bios,negative
1358_0,"Because we did not purchase the extended warranty in time, we are on the hook for the repair.",extended warranty,negative
108_0,"It started out by randomly ceasing to charge when it was plugged in (mousing over the battery icon would read, for example, ""74%, plugged in, not charging""), requiring me to unplug it and plug it back in several times to get it to charge.",charging,negative
108_1,"It started out by randomly ceasing to charge when it was plugged in (mousing over the battery icon would read, for example, ""74%, plugged in, not charging""), requiring me to unplug it and plug it back in several times to get it to charge.",charge,negative
108_2,"It started out by randomly ceasing to charge when it was plugged in (mousing over the battery icon would read, for example, ""74%, plugged in, not charging""), requiring me to unplug it and plug it back in several times to get it to charge.",charge,neutral
1818_0,This laptop looked brand new and was shipped very quickly.,shipped,positive
1112_0,"Info: Windows failed to load because the kernal is missing, or corrupt.",Windows,negative
1112_1,"Info: Windows failed to load because the kernal is missing, or corrupt.",kernal,negative
1576_0,"The display on this computer is the best I've seen in a very long time, the battery life is very long and very convienent.",display,positive
1576_1,"The display on this computer is the best I've seen in a very long time, the battery life is very long and very convienent.",battery life,positive
1409_0,"But the quality, in general was less than the worth of the cheap laptop.",quality,negative
458_0,In the first moth of owning this computer its hardrive failed which had to be replaced.,hardrive,negative
1530_0,Its also FUN to use!,use,positive
1612_0,"The graphics and screen are stunning and although I was a PC person, I was able to understand how to use a mac fairly quickly.",graphics,positive
1612_1,"The graphics and screen are stunning and although I was a PC person, I was able to understand how to use a mac fairly quickly.",screen,positive
2273_0,"WIth the upgraded memory, the MacBook Pro never has an issue running many many applications at once!",upgraded memory,positive
2273_1,"WIth the upgraded memory, the MacBook Pro never has an issue running many many applications at once!",applications,neutral
2273_2,"WIth the upgraded memory, the MacBook Pro never has an issue running many many applications at once!",running,positive
2824_0,"Simple to use, and great graphics.",graphics,positive
2824_1,"Simple to use, and great graphics.",use,positive
2934_0,The internet speed is spectacular.,internet speed,positive
624_0,They claim call center is still down.,call center,negative
2408_0,Mac also has many apps and programs that are quite cheap or free.,apps,positive
2408_1,Mac also has many apps and programs that are quite cheap or free.,programs,positive
2984_0,"My husband uses it mostly for games, email and music.",games,neutral
2565_0,I just took the broken cords into the Apple store and they gave me new ones.,cords,positive
909_0,"Apparently under the screen there are 2 little screws and when the screen gets moved back and forth, they come loose.",screen,neutral
909_1,"Apparently under the screen there are 2 little screws and when the screen gets moved back and forth, they come loose.",screen,neutral
2347_0,"Being a PC user my whole life, it's taking a bit of time to adapt to the OS of a Mac but I'm finding my way around.",OS,neutral
1470_0,The computer will constantly be getting hot and burning your leg unless you go through the hassle of taking off the entire back of it just to clean out the fan.,fan,negative
1601_0,"I have in the past gotten superfine sandpaper and ""fixed"" the edges by rounding them off.",edges,negative
1747_0,Downfalls: sharp edges.,edges,negative
2537_0,i needed one to be able to carry to work everyday and this one seems to fit all of the criteria.,carry,neutral
