id,text,aspect,sentiment
1726473:0_1,"Average to good Thai food, but terrible delivery.",delivery,negative
1726473:1_0,I've waited over one hour for food.,NULL,negative
1726473:2_0,They were very abrupt with me when I called and actually claimed the food was late because they were out of rice.,NULL,negative
1726473:3_0,A Thai restaurant out of rice during dinner?,Thai restaurant,negative
1726473:4_0,"The food arrived 20 minutes after I called, cold and soggy.",food,negative
1726473:4_1,"The food arrived 20 minutes after I called, cold and soggy.",NULL,negative
1727363:1_0,This is a wonderful place on all stand points especially value ofr money.,place,positive
1727363:1_1,This is a wonderful place on all stand points especially value ofr money.,place,positive
1727363:2_0,An excellent service,service,positive
1728733:1_0,We were greeted promptly by the waiter who was very nice and cordial.,waiter,positive
1728733:2_0,She was very helpful in suggesting us drinks and helped us in ordering a lot of good dishes since we knew nothing about Indian food.,NULL,positive
1728733:2_1,She was very helpful in suggesting us drinks and helped us in ordering a lot of good dishes since we knew nothing about Indian food.,dishes,positive
1728733:4_0,The food looked very appetizing and delicious since it came on a variety of fancy plates.,food,positive
1728733:5_0,We ended our great experience by having Gulab Jamun (dessert) recommended by the waiter.,Gulab Jamun (dessert),positive
1728733:6_0,I thanked my friend who recommended me this restaurant and will certainly recommend it to others.,restaurant,positive
1730014:1_0,"Service here was great, food was fantastic.",Service,positive
1730014:1_1,"Service here was great, food was fantastic.",food,positive
1730014:2_0,"Guacamole+shrimp appetizer was really great, we both had the filet, very good, didn't much like the frites that came with, but the filet was so good, neither of us cared.",Guacamole+shrimp appetizer,positive
1730014:2_1,"Guacamole+shrimp appetizer was really great, we both had the filet, very good, didn't much like the frites that came with, but the filet was so good, neither of us cared.",filet,positive
1730014:2_2,"Guacamole+shrimp appetizer was really great, we both had the filet, very good, didn't much like the frites that came with, but the filet was so good, neither of us cared.",frites,negative
1730014:3_0,Will absolutely visit again.,NULL,positive
1730127:0_0,You cannot go wrong with this place.,place,positive
1730127:1_0,"The food is outstanding and the service is quick, friendly and very professional.",food,positive
1730127:1_1,"The food is outstanding and the service is quick, friendly and very professional.",service,positive
1730127:2_0,"Always a nice crowd, but never loud.",crowd,positive
1730127:2_1,"Always a nice crowd, but never loud.",NULL,positive
1730127:3_0,Go here.,NULL,positive
1730127:4_0,Good for dates or with friends.,NULL,positive
1730447:0_0,I am reluctant to write because I would not want my jem of a pizza place to become overcrowded.,pizza place,positive
1730447:1_0,"However, it is jus too good to not praise it.",NULL,positive
1730447:2_0,"By far, the best pizza in Manhattan.",pizza,positive
1730447:3_0,"The crust is thin, the ingredients are fresh and the staff is friendly.",crust,positive
1730447:3_1,"The crust is thin, the ingredients are fresh and the staff is friendly.",staff,positive
1730447:3_2,"The crust is thin, the ingredients are fresh and the staff is friendly.",ingredients,positive
1746113:1_0,The menu has so many fish items and oysters.,menu,positive
1746113:3_0,"The fish was really,really fresh.",fish,positive
1746113:5_0,We all agreed that mare is one of the best seafood restaurants in New York.,mare,positive
1748813:0_0,I stumbled upon this great pizzeria as I explored my new neighborhood.,pizzeria,positive
1748813:1_0,All of the pizzas are terrific and the price is even better!,pizzas,positive
1748813:1_1,All of the pizzas are terrific and the price is even better!,NULL,positive
1748813:2_0,I highly recommend the Sophia pizza.,Sophia pizza,positive
1748813:3_0,It's to die for!,NULL,positive
1748839:0_0,The food was mediocre at best but it was the horrible service that made me vow never to go back.,food,negative
1748839:0_1,The food was mediocre at best but it was the horrible service that made me vow never to go back.,service,negative
1748839:1_0,"Immediately after we paid, the waiter took the money and said, okay, you guys are outta here.",waiter,negative
1748839:6_0,So rushing us out was absolutely unnecessary!,NULL,negative
1748839:7_0,"For the people who want great food plus great service, Roxy is a place to AVOID!",food,negative
1748839:7_1,"For the people who want great food plus great service, Roxy is a place to AVOID!",service,negative
378848:2_0,I'm sure I'll return for a final judgement tho.,NULL,neutral
378848:3_0,"The blond wood decor is very soothing, the premium sake is excellent and the service is great.",blond wood decor,positive
378848:3_1,"The blond wood decor is very soothing, the premium sake is excellent and the service is great.",premium sake,positive
378848:3_2,"The blond wood decor is very soothing, the premium sake is excellent and the service is great.",service,positive
397331:0_0,Mizu is the Japenese find in Grammercy.,Mizu,positive
397331:1_0,"While their kitchen food is delicious, their Sushi is out of this world.",kitchen food,positive
397331:1_1,"While their kitchen food is delicious, their Sushi is out of this world.",Sushi,positive
397331:2_0,Mizu is home to creative and unique rolls not to found anywhere else.,rolls,positive
397331:3_0,"Not only is the cuisine the best around, the service has always been attentive and charming.",cuisine,positive
397331:3_1,"Not only is the cuisine the best around, the service has always been attentive and charming.",service,positive
397331:4_0,Warning: You may find it difficult to dine at other Japanese restaurants after a visit to Mizu!,Mizu,positive
404464:0_0,"Thalia is a beautiful restaurant with beautiful people serving you, but the food doesn't quite match up.",people,positive
404464:0_1,"Thalia is a beautiful restaurant with beautiful people serving you, but the food doesn't quite match up.",food,negative
404464:0_2,"Thalia is a beautiful restaurant with beautiful people serving you, but the food doesn't quite match up.",Thalia,positive
404464:1_0,I ordered the smoked salmon and roe appetizer and it was off flavor.,smoked salmon and roe appetizer,negative
404464:2_0,"The entree was bland and small, dessert was not inspired.",entree,negative
404464:2_1,"The entree was bland and small, dessert was not inspired.",entree,negative
404464:2_2,"The entree was bland and small, dessert was not inspired.",dessert,negative
404464:3_0,I expected quite a bit more from such an expensive menu.,menu,negative
404464:3_1,I expected quite a bit more from such an expensive menu.,menu,negative
426805:0_0,"The view is spectacular, and the food is great.",view,positive
426805:0_1,"The view is spectacular, and the food is great.",food,positive
426805:1_0,Wonderful strawberry daiquiries as well!,strawberry daiquiries,positive
426805:2_0,Definitely worth the trip to Battery Park City!,NULL,positive
426805:3_0,One of my favorite places in Manhattan.,NULL,positive
426930:0_0,Authentic Taiwanese food that's cheap... what more could you ask for?,Taiwanese food,positive
426930:0_1,Authentic Taiwanese food that's cheap... what more could you ask for?,Taiwanese food,positive
426930:1_0,(Besides that there should be more restaurants like it around the city).,NULL,positive
426930:2_0,The cold appetizer dishes taste like the way I remember them to taste when I was growing up in Taiwan.,cold appetizer dishes,positive
430342:0_0,delicious simple food in nice outdoor atmosphere.,food,positive
430342:0_1,delicious simple food in nice outdoor atmosphere.,food,positive
430342:0_2,delicious simple food in nice outdoor atmosphere.,outdoor atmosphere,positive
430342:1_0,"Kind, attentive wait staff.",wait staff,positive
430342:2_0,I really like both the scallops and the mahi mahi (on saffron risotto-yum!).,scallops,positive
430342:2_1,I really like both the scallops and the mahi mahi (on saffron risotto-yum!).,mahi mahi (on saffron risotto,positive
430342:3_0,My friend devoured her chicken and mashed potatos.,chicken and mashed potatos,positive
430342:4_0,Delicious crab cakes too.,crab cakes,positive
430342:5_0,"Even if the food wasn't this good, the garden is a great place to sit outside and relax.",garden,positive
430342:5_1,"Even if the food wasn't this good, the garden is a great place to sit outside and relax.",food,positive
430342:6_0,Great neighborhood joint.,joint,positive
433878:0_0,This is a nice pizza place with good selection of thin crust pizza including the Basil slice.,selection of thin crust pizza,positive
433878:0_1,This is a nice pizza place with good selection of thin crust pizza including the Basil slice.,selection of thin crust pizza,positive
433878:0_2,This is a nice pizza place with good selection of thin crust pizza including the Basil slice.,pizza place,positive
433878:0_3,This is a nice pizza place with good selection of thin crust pizza including the Basil slice.,Basil slice,positive
433878:1_0,"Their calzones are horrific, bad, vomit-inducing, YUCK.",calzones,negative
433878:2_0,They smell like they stuff them with old canned vegetables like the spinach mushroom calzone.,NULL,negative
433878:3_0,The counter service is bad.,counter service,negative
433878:4_0,They charge different prices all the time.,NULL,negative
433878:5_0,"They're rude at times, and not very friendly.",NULL,negative
433878:6_0,NO PIZZA 33 for me!,PIZZA 33,negative
436868:0_0,"Anybody who likes this place must be from a different planet, where greasy, dry and tasteless are complimentary.",NULL,negative
436868:1_0,"The dosas are skimpy, unattractive and drip with grease, and personally I'd drink popcorn topping before I'd eat another one of these.",dosas,negative
436868:1_1,"The dosas are skimpy, unattractive and drip with grease, and personally I'd drink popcorn topping before I'd eat another one of these.",dosas,negative
436868:2_0,"The sandwiches are dry, tasteless and way overpriced.",sandwiches,negative
436868:2_1,"The sandwiches are dry, tasteless and way overpriced.",sandwiches,negative
436868:3_0,"Calling the place Hampton Chutney Co. does warn you that these folks offer more style than substance, but in this unattractive room with unhelpful clerks there was a dearth of the former too.",place,negative
436868:3_1,"Calling the place Hampton Chutney Co. does warn you that these folks offer more style than substance, but in this unattractive room with unhelpful clerks there was a dearth of the former too.",room,negative
436868:3_2,"Calling the place Hampton Chutney Co. does warn you that these folks offer more style than substance, but in this unattractive room with unhelpful clerks there was a dearth of the former too.",clerks,negative
444818:0_0,"Seriously, this place kicks ass.",place,positive
444818:1_0,"The atmosphere is unheralded, the service impecible, and the food magnificant.",atmosphere,positive
444818:1_1,"The atmosphere is unheralded, the service impecible, and the food magnificant.",service,positive
444818:1_2,"The atmosphere is unheralded, the service impecible, and the food magnificant.",food,positive
444818:2_0,"Best Italian food I ever had (and being Italian, that means alot).",Italian food,positive
444818:3_0,"It is nearly impossible to get a table, so if you ever have the chance to go here for dinner, DO NOT pass it up.",NULL,positive
445960:0_0,"This is such a lovely, peaceful place to eat outside.",place,positive
445960:1_0,The restaurant looks out over beautiful green lawns to the Hudson River and the Statue of Liberty.,restaurant,positive
445960:2_0,"It is set far from the small street it's on, and there is no traffic noise.",NULL,positive
445960:3_0,"The food is good, especially their more basic dishes, and the drinks are delicious.",food,positive
445960:3_1,"The food is good, especially their more basic dishes, and the drinks are delicious.",basic dishes,positive
445960:3_2,"The food is good, especially their more basic dishes, and the drinks are delicious.",drinks,positive
445960:4_0,"This is a great place to take out-of-towners, and perfect for watching the sunset.",place,positive
447697:0_0,Great sushi experience.,sushi,positive
447697:1_0,Nice value.,NULL,positive
447697:2_0,Unique apppetizers.,apppetizers,positive
447697:3_0,Try sushimi cucumber roll.,sushimi cucumber roll,positive
449802:0_0,"Good spreads, great beverage selections and bagels really tasty.",spreads,positive
449802:0_1,"Good spreads, great beverage selections and bagels really tasty.",beverage selections,positive
449802:0_2,"Good spreads, great beverage selections and bagels really tasty.",bagels,positive
449802:1_0,THE BIG COMPLAINT: NO TOASTING AVAILABLE.,NULL,negative
449802:3_0,Murray won't do it.,NULL,negative
449802:5_0,But who says Murray's is anything about service.,service,negative
449802:6_0,"So close, but not good enough.",NULL,neutral
454704:0_0,Don't be fooled by crowds of people.,NULL,negative
454704:1_0,The service is awful.,service,negative
454704:2_0,This place is not worth the prices.,place,negative
454704:2_1,This place is not worth the prices.,place,negative
454704:3_0,"Also, don't plan on asking for your favorite roll, if it's not on the menu, you can't have it.",NULL,negative
455623:0_0,Love Pizza 33..,Pizza 33,positive
455623:1_0,I will be out with friends and all of a sudden I am hungry and I only crave one thing... their Pizza.,Pizza,positive
455623:3_0,It hits the spot every time,NULL,positive
461928:0_0,This tiny Williamsburg spot is always pleasantly surprising.,Williamsburg spot,positive
461928:1_0,The pizza is delicious and the proprietor is one of the nicest in NYC.,pizza,positive
461928:1_1,The pizza is delicious and the proprietor is one of the nicest in NYC.,proprietor,positive
461928:3_0,I've been many time and have never been disappointed.,NULL,positive
464215:1_0,They even scoop it out nice (for those on a diet) not too much not to little.,NULL,positive
464215:2_0,The cream cheeses are out of this world and I love that coffee!!,cream cheeses,positive
464215:2_1,The cream cheeses are out of this world and I love that coffee!!,coffee,positive
464342:0_0,"Bagels are ok, but be sure not to make any special requests!",Bagels,neutral
464342:0_1,"Bagels are ok, but be sure not to make any special requests!",NULL,negative
464342:1_0,I asked for an open faced cheese sandwich and the manager basically told me to take my business elsewhere!,manager,negative
464342:2_0,Be sure not to get anything other than bagels!..,NULL,negative
464342:2_1,Be sure not to get anything other than bagels!..,bagels,positive
464342:3_0,the turkey burgers are scary!,turkey burgers,negative
470488:0_0,The worst excuse for Japanese food I've ever encountered.,NULL,negative
470488:1_0,The soup for the udon was soy sauce and water.,soup for the udon,negative
470488:2_0,The sushi was awful!,sushi,negative
470488:3_0,The rice was poor quality and was cooked so badly it was hard.,rice,negative
470488:4_0,"Furthermore, the rice had no seasoning, so the sushi was bland and disgusting.",rice,negative
470488:4_1,"Furthermore, the rice had no seasoning, so the sushi was bland and disgusting.",sushi,negative
470488:5_0,"The fish was adequate, but inexpertly sliced.",fish,negative
470488:6_0,It is obvious that no one in the restaurant has any idea about or experience with Japanese cuisine.,Japanese cuisine,negative
475298:0_0,"Good, fast service.",service,positive
475298:1_0,I would highly recommend.,NULL,positive
475298:2_0,Food is great and inexpensive.,Food,positive
475298:2_1,Food is great and inexpensive.,Food,positive
475298:3_0,The location is perfect.,location,positive
475298:4_0,Give it a try and enjoy.,NULL,positive
475512:2_0,"Well, this place is so Ghetto its not even funny.",place,negative
475512:3_0,If you like your music blasted and the system isnt that great and if you want to pay at least 100 dollar bottle minimun then you'll love it here.,bottle,negative
475512:3_1,If you like your music blasted and the system isnt that great and if you want to pay at least 100 dollar bottle minimun then you'll love it here.,music,negative
475512:4_0,Would NEVER go back there.,NULL,negative
476473:0_0,Awsome Pizza especially the Margheritta slice.,Pizza,positive
476473:0_1,Awsome Pizza especially the Margheritta slice.,Margheritta slice,positive
476473:1_0,Always busy but fast moving.,NULL,positive
476473:2_0,Great atmoshere and worth every bit.,atmoshere,positive
476473:2_1,Great atmoshere and worth every bit.,NULL,positive
476473:3_0,Open late (well as late as I ever got there and I'm a night person),NULL,positive
483111:0_0,Winnie and her staff are the best crew you can find serving you.,staff,positive
483111:0_1,Winnie and her staff are the best crew you can find serving you.,Winnie,positive
483111:1_0,The food is reliable and the price is moderate.,food,positive
483111:1_1,The food is reliable and the price is moderate.,NULL,neutral
483111:2_0,What more can you ask for?,NULL,positive
485026:0_0,"For authentic Thai food, look no further than Toons.",Thai food,positive
485026:2_0,"Try the Pad Thai, or sample anything on the appetizer menu...they're all delicious.",Pad Thai,positive
485026:2_1,"Try the Pad Thai, or sample anything on the appetizer menu...they're all delicious.",appetizer menu,positive
485767:0_0,Everything about this restaurant was special.,restaurant,positive
485767:1_0,"The service was attentive, yet discreet.",service,positive
485767:2_0,The flavors robust and subtle.,NULL,positive
485767:3_0,The brioche and lollies as party favors is a cute and sweet touch to a most memorable meal.,brioche and lollies,positive
485767:4_0,I'm saving up for my next visit.,NULL,positive
485966:1_0,The place was quiet and delightful.,place,positive
485966:2_0,Service was good and food is wonderful.,Service,positive
485966:2_1,Service was good and food is wonderful.,food,positive
485966:3_0,I did not try the caviar but I tried their salmon and crab salad (they are all good)  ,salmon,positive
485966:3_1,I did not try the caviar but I tried their salmon and crab salad (they are all good)  ,crab salad,positive
485966:4_0,It is definitely a good spot for snacks and chat.,spot,positive
490565:0_0,"As a retired hipster, I can say with some degree of certainty that for the last year Lucky Strike has been the best laid-back late night in the city.",Lucky Strike,positive
490565:1_0,"The wait staff is pleasant, fun, and for the most part gorgeous (in the wonderful aesthetic beautification way, not in that she's-way-cuter-than-me-that-b@#$* way).",wait staff,positive
490565:2_0,"The food is yummy, especially their cooked-to-perfection mussels in spicy tomato sauce and their shoestring crispy fries.",food,positive
490565:2_1,"The food is yummy, especially their cooked-to-perfection mussels in spicy tomato sauce and their shoestring crispy fries.",mussels in spicy tomato sauce,positive
490565:2_2,"The food is yummy, especially their cooked-to-perfection mussels in spicy tomato sauce and their shoestring crispy fries.",fries,positive
490565:3_0,"But the best part about LS is the late night atmosphere, delightfully free of the BTs.",late night atmosphere,positive
490565:4_0,"You can get a completely delish martini in a glass (that's about 2 1/2 drinks) for $8.50 (I recommend the Vanilla Shanty, mmmm!) in a great homey setting with great music.",martini,positive
490565:4_1,"You can get a completely delish martini in a glass (that's about 2 1/2 drinks) for $8.50 (I recommend the Vanilla Shanty, mmmm!) in a great homey setting with great music.",martini,positive
490565:4_2,"You can get a completely delish martini in a glass (that's about 2 1/2 drinks) for $8.50 (I recommend the Vanilla Shanty, mmmm!) in a great homey setting with great music.",martini,positive
490565:4_3,"You can get a completely delish martini in a glass (that's about 2 1/2 drinks) for $8.50 (I recommend the Vanilla Shanty, mmmm!) in a great homey setting with great music.",Vanilla Shanty,positive
490565:4_4,"You can get a completely delish martini in a glass (that's about 2 1/2 drinks) for $8.50 (I recommend the Vanilla Shanty, mmmm!) in a great homey setting with great music.",setting,positive
490565:4_5,"You can get a completely delish martini in a glass (that's about 2 1/2 drinks) for $8.50 (I recommend the Vanilla Shanty, mmmm!) in a great homey setting with great music.",music,positive
490565:5_0,"The in-house lady DJ on Saturday nights has outrageously good taste in music, and moreover, takes requests.",in-house lady DJ,positive
490565:6_0,You can't go wrong with this place.,place,positive
493013:0_0,Suan is a great place that I often take my friends (classmates) too.,Suan,positive
493013:1_0,"Its location is good and the fact that Hutner College is near and their prices are very reasonable, makes students go back to Suan again and again.",location,positive
493013:1_1,"Its location is good and the fact that Hutner College is near and their prices are very reasonable, makes students go back to Suan again and again.",Suan,positive
493013:2_0,I LOVE their Thai,Thai,positive
493013:3_0,noodles with shrimp and chicken and coconut juice is the MUST!,noodles with shrimp and chicken and coconut juice,positive
493013:5_0,I will go back to Suan soon!,Suan,positive
493013:6_0,In summer-eat outside on a terrace (another great feature of Suan)!!!,terrace,positive
493514:0_0,I cannot imagine a friendlier staff working in a restaurant.,staff,positive
493514:1_0,I cannot imagine better Indian food in all of the city.,Indian food,positive
493514:2_0,I cannot imagine you not rushing out to eat there.,NULL,positive
494850:1_0,"During the course of the past 3 months, the chef and staff changed and it was not for the better.",chef,negative
494850:1_1,"During the course of the past 3 months, the chef and staff changed and it was not for the better.",staff,negative
494850:2_0,I wish they would change back to what it was before.,NULL,negative
494850:3_0,The food now is inconsistent.,food,negative
496132:0_0,This is the kind of place you'd like to take all your friends to and still keep a secret.,place,positive
496132:1_0,The setting is casual and romantic.,setting,positive
496132:2_0,Prices are very good.,NULL,positive
496132:3_0,The food is excellent! ,food,positive
496132:4_0,"if you're daring, try the balsamic vinegar over icecream, it's wonderful!",balsamic vinegar over icecream,positive
498657:0_0,"Do not get the Go Go Hamburgers, no matter what the reviews say.",Go Go Hamburgers,negative
498657:1_0,They were such a rip-off ($8.95 for four small meat patties in steamed buns) and not worth trying.,NULL,negative
498657:1_1,They were such a rip-off ($8.95 for four small meat patties in steamed buns) and not worth trying.,NULL,negative
498657:1_2,They were such a rip-off ($8.95 for four small meat patties in steamed buns) and not worth trying.,NULL,negative
498657:3_0,Steamed fresh so brought hot hot hot to your table.,NULL,positive
498657:4_0,"The wait here is long for dim sum, but if you don't like sharing tables or if the typical raucous dim sum atmosphere is not your gig, this is a sleek (for Chinatown) alternative.",wait,negative
498657:4_1,"The wait here is long for dim sum, but if you don't like sharing tables or if the typical raucous dim sum atmosphere is not your gig, this is a sleek (for Chinatown) alternative.",atmosphere,negative
498657:4_2,"The wait here is long for dim sum, but if you don't like sharing tables or if the typical raucous dim sum atmosphere is not your gig, this is a sleek (for Chinatown) alternative.",NULL,negative
498657:5_0,"A few tips: skip the turnip cake, roast pork buns and egg custards.",turnip cake,negative
498657:5_1,"A few tips: skip the turnip cake, roast pork buns and egg custards.",roast pork buns,negative
498657:5_2,"A few tips: skip the turnip cake, roast pork buns and egg custards.",egg custards,negative
498657:6_0,These are overpriced and you can get better just around the corner:,NULL,negative
498657:6_1,These are overpriced and you can get better just around the corner:,NULL,negative
503807:1_0,I was pleasantly suprised.,NULL,positive
503807:2_0,The food was exceptional.,food,positive
503807:4_0,"I choose to go with one of the special, the braised lamb shank in red wine, which was excellent.",braised lamb shank in red wine,positive
503807:5_0,The service was friendly and the atmosphere was casual.,service,positive
503807:5_1,The service was friendly and the atmosphere was casual.,atmosphere,neutral
503807:6_0,The restaurant is a bit noisy but that is something that can be overlooked once you sit down and enjoy a great meal,meal,positive
503807:6_1,The restaurant is a bit noisy but that is something that can be overlooked once you sit down and enjoy a great meal,restaurant,negative
505535:0_0,this little place has a cute interior decor and affordable city prices.,interior decor,positive
505535:0_1,this little place has a cute interior decor and affordable city prices.,place,positive
505535:1_0,"the pad se ew chicken was delicious, however the pad thai was far too oily.",pad se ew chicken,positive
505535:1_1,"the pad se ew chicken was delicious, however the pad thai was far too oily.",pad thai,negative
507755:0_0,"Have eaten at Ginger House several times, and it's always good.",Ginger House,positive
507755:1_0,The fried dumplings are GREAT!,fried dumplings,positive
507755:2_0,Finally a reliable Chinese restaurant!,Chinese restaurant,positive
507844:0_0,This place would be so much better served by being run by a group that actually understands customer service.,customer service,negative
