id,text,aspect,sentiment
1390357:2_0,"I like the ambience, it's very dark and original.",ambience,positive
1390357:4_0,The sushi is amazing!!! ,sushi,positive
1390357:5_0,And amazingly cheap.,NULL,positive
1390357:6_0,Big thumbs up!,NULL,positive
1394712:0_0,Very affordable and excellent ambient!,ambient,positive
1394712:0_1,Very affordable and excellent ambient!,NULL,positive
1394712:1_0,We ordered some beef and noodle soup dishes from the Thai section of the menu but nothing we got was Thai.,beef and noodle soup dishes,negative
1394712:2_0,We were very disappointed.,NULL,negative
1394712:3_0,We won't go to this place again for a good meal.,meal,negative
1394712:4_0,"However, I think this place is a good hang out spot.",place,positive
1395421:0_0,My Girlfriend and I stumbled onto this hopping place the other night and had a great time!,place,positive
1395421:1_0,THe Pizza and wine were excellent-the service too--but what really MADE this place was the backyard dining area.,Pizza,positive
1395421:1_1,THe Pizza and wine were excellent-the service too--but what really MADE this place was the backyard dining area.,wine,positive
1395421:1_2,THe Pizza and wine were excellent-the service too--but what really MADE this place was the backyard dining area.,service,positive
1395421:1_3,THe Pizza and wine were excellent-the service too--but what really MADE this place was the backyard dining area.,backyard dining area,positive
1395421:2_0,It is one the nicest outdoor restaurants I have ever seen in NY--I am from Italy and this place rivals the ones in my country.,outdoor restaurants,positive
1395421:3_0,"They tell me they are going to cover the garden in glass for the winter, so i'm looking forward to going there on a snowy night to enjoy it.",NULL,positive
1395421:4_0,Check this place out!,place,positive
1395421:5_0,HIGHLY RECOMMENDED!!!!!,NULL,positive
1398844:0_0,"First of all, this place is *not* romantic, as claimed by Citysearch's editorial review.",place,negative
1398844:1_0,"Either that, or the editor's idea of romance must be sharing a conversation with the next table, while trying to speak louder than the traffic on 57th.",NULL,negative
1398844:2_0,"The tables are crammed way too close, the menu is typical of any Italian restaurant, and the wine list is simply overpriced.",tables,negative
1398844:2_1,"The tables are crammed way too close, the menu is typical of any Italian restaurant, and the wine list is simply overpriced.",menu,neutral
1398844:2_2,"The tables are crammed way too close, the menu is typical of any Italian restaurant, and the wine list is simply overpriced.",wine list,negative
1398844:3_0,Slightly above average wines start at $70+ with only one selection listed at $30+.,wines,negative
1398844:3_1,Slightly above average wines start at $70+ with only one selection listed at $30+.,wines,negative
1398844:4_0,Service is not what one would expect from a joint in this price category.,Service,negative
1398844:5_0,"For instance, plates were just dumped on the table, I was handed the wine list upside down, etc.... ",NULL,negative
1398844:6_0,Somehow working the italian charm with constant mille grazie does not constitute proper service.,service,negative
1398844:7_0,"To be completely fair, the only redeeming factor was the food, which was above average, but couldn't make up for all the other deficiencies of Teodora.",food,positive
1398844:7_1,"To be completely fair, the only redeeming factor was the food, which was above average, but couldn't make up for all the other deficiencies of Teodora.",Teodora,negative
1404042:1_0,Not one of our meals was edible - bland and/or made with weird rosemary or orange flavoring.,meals,negative
1404042:1_1,Not one of our meals was edible - bland and/or made with weird rosemary or orange flavoring.,rosemary or orange flavoring,negative
1404042:2_0,Fish was overdone.,Fish,negative
1404042:3_0,"Cute place, nice wait staff but would never go there again.",wait staff,positive
1404042:4_0,Someone else recommended the dessert - we also left that.,dessert,negative
1404042:5_0,One of us actually liked the expresso - that's it.,expresso,positive
1404042:6_0,"Skip this restaurant, it's a big disappointment.",restaurant,negative
1410878:0_0,Myagi is one of my favorite restaurants in the City; the place the negative reviews describe sound like they were somewhere else.,Myagi,positive
1410878:1_0,I've never had bad service and the fish is fresh and delicious.,service,positive
1410878:1_1,I've never had bad service and the fish is fresh and delicious.,fish,positive
1410878:2_0,Their tuna tartar appetizer is to die for.,tuna tartar appetizer,positive
1413697:0_0,"I come from a family of pizzeria owners, and I'm almost ashamed to say that the pizza in Fornino's blows my families receipies away.",pizza,positive
1413697:1_0,It is simply amazing.,NULL,positive
1413697:2_0,The place is so cool and the service is prompt and curtious.,service,positive
1413697:2_1,The place is so cool and the service is prompt and curtious.,place,positive
1413697:3_0,I highly recommend to anyone to give this place a try.,place,positive
1413697:4_0,You will find yourself returning quite often.,NULL,positive
1417496:0_0,A restaurant that doesn't try to do anything except serve great food with great service in a pleasant atmosphere.,food,positive
1417496:0_1,A restaurant that doesn't try to do anything except serve great food with great service in a pleasant atmosphere.,service,positive
1417496:0_2,A restaurant that doesn't try to do anything except serve great food with great service in a pleasant atmosphere.,atmosphere,positive
1417496:1_0,No gimmicks here -- the food speaks for itself in its freshness and preparation.,food,positive
1417496:2_0,The dining room is quietly elegant with no music to shout over -- how refreshing!,dining room,positive
1417496:3_0,"The service was impeccable and unobtrusive -- the staff knows what they are there to do -- to know their menu, present your meal, and attend to your needs.",service,positive
1417496:3_1,"The service was impeccable and unobtrusive -- the staff knows what they are there to do -- to know their menu, present your meal, and attend to your needs.",staff,positive
1417496:4_0,"Looking around, I saw a room full of New Yorkers enjoying a real meal in a real restaurant, not a clubhouse of the fabulous trying to be seen.",meal,positive
1417496:4_1,"Looking around, I saw a room full of New Yorkers enjoying a real meal in a real restaurant, not a clubhouse of the fabulous trying to be seen.",restaurant,positive
1417496:5_0,Beautiful experience.,NULL,positive
1430994:0_0,The view is breathtaking the service is top notch... the ambiance is wonderfull.,view,positive
1430994:0_1,The view is breathtaking the service is top notch... the ambiance is wonderfull.,service,positive
1430994:0_2,The view is breathtaking the service is top notch... the ambiance is wonderfull.,ambiance,positive
1430994:1_0,The staff offers impeccable service.,staff,positive
1430994:2_0,I had Lobster Bisque it has 2 oz. of Maine Lobster in it.,Lobster Bisque,positive
1430994:3_0,My boyfriend had the New England Chowder it was good but I think the award should go to the Lobster Bisque.,New England Chowder,positive
1430994:3_1,My boyfriend had the New England Chowder it was good but I think the award should go to the Lobster Bisque.,Lobster Bisque,positive
1430994:5_0,It was divine melts in your mouth.,NULL,positive
1430994:6_0,My boyfriend had Prime Rib it was good .,Prime Rib,positive
1430994:7_0,We didn't want a bottle of bubbly on a weekday so we each got little bottles of Korbett it was just enough. ,bottles of Korbett,positive
1430994:9_0,It's cuz it's so good you need to taste it!!! ,NULL,positive
1430994:10_0,All in all we're already coming up with excuses to go ahead really soon in the next few wks!!!!,NULL,positive
1431154:0_0,My wife and I ate here earlier this week and have not stopped ranting and raving about the food.,food,positive
1431154:1_0,If you like spicy food get the chicken vindaloo.,chicken vindaloo,positive
1431154:2_0,It's very spicy but not offensive.,NULL,positive
1431154:3_0,We will definitely go back.,NULL,positive
1432551:0_0,Go to Volare for 1st class service and terrific food.,service,positive
1432551:0_1,Go to Volare for 1st class service and terrific food.,food,positive
1432551:1_0,The portions are large and the servers always surprise us with a different starter.,portions,positive
1432551:2_0,The wine list is excellent.,wine list,positive
1439875:0_0,The food is amazing... especially if you get the Chef's tasting menu and your favourite bottle (or two!) of wine from an extensive selection of wines.,food,positive
1439875:0_1,The food is amazing... especially if you get the Chef's tasting menu and your favourite bottle (or two!) of wine from an extensive selection of wines.,selection of wines,positive
1439875:0_2,The food is amazing... especially if you get the Chef's tasting menu and your favourite bottle (or two!) of wine from an extensive selection of wines.,Chef's tasting menu,positive
1439875:1_0,"The place is small and intimate and you may feel a little crowded, but the service is excellent and it's great for friends out, a romantic date, or a special occassion.",service,positive
1439875:3_0,The food can get pricey but the prixe fixe tasting menu is the greatest food for a good price and they cater the food to any food allergies or food you don't like.,food,negative
1439875:3_1,The food can get pricey but the prixe fixe tasting menu is the greatest food for a good price and they cater the food to any food allergies or food you don't like.,prixe fixe tasting menu,positive
1439875:3_2,The food can get pricey but the prixe fixe tasting menu is the greatest food for a good price and they cater the food to any food allergies or food you don't like.,prixe fixe tasting menu,positive
1439875:3_3,The food can get pricey but the prixe fixe tasting menu is the greatest food for a good price and they cater the food to any food allergies or food you don't like.,NULL,positive
1439875:5_0,Please be aware that it's CASH or AMEX only!,NULL,neutral
1448587:0_0,"With the exception of our lemon salad that had so much pepper on it that our eyes started watering, the food here was decent, not great.",food,neutral
1448587:0_1,"With the exception of our lemon salad that had so much pepper on it that our eyes started watering, the food here was decent, not great.",lemon salad,negative
1448587:1_0,The menu is very limited - i think we counted 4 or 5 entrees.,menu,negative
1448587:2_0,"We ordered the special, grilled branzino, that was so infused with bone, it was difficult to eat.",grilled branzino,negative
1448587:3_0,"The decor in this place is very diner-ish and the kind of place you expect in the East Village - not romantic, just simple, small and sparse.",decor,neutral
1448587:4_0,Problem is nothing at Prune is particularly memorable.,Prune,negative
1448587:5_0,No plans to return anytime soon.,NULL,negative
1451107:0_0,This place is so much fun.,place,positive
1451107:1_0,Our family never expected such incredible entertainment in a restaurant.,entertainment,positive
1451107:4_0,Our food was great too!,food,positive
1451107:5_0,And really large portions.,portions,positive
1451107:6_0,The staff was the friendliest that have seen in New York.,staff,positive
1451107:7_0,We will go back every time we are in the City.,NULL,positive
1451109:0_0,If you want something really different than try Jekyll and Hyde.,Jekyll and Hyde,positive
1451109:1_0,It is a lot of fun with live entertainment and all kinds of Disney type special effects.,NULL,positive
1451109:2_0,The food was pretty tradional but it was hot and good with large portions.,food,positive
1451109:2_1,The food was pretty tradional but it was hot and good with large portions.,portions,positive
1451109:3_0,I highly recommend it.,NULL,positive
1457607:0_0,The place is a lot of fun.,place,positive
1457607:1_0,My six year old loved it.,NULL,positive
1457607:2_0,The characters really make for an enjoyable experience.,characters,positive
1457607:3_0,"The food however, is what one might expect.",food,negative
1457607:4_0,It is very overpriced and not very tasty.,NULL,negative
1457607:4_1,It is very overpriced and not very tasty.,NULL,negative
1457607:5_0,"However, I think Jeckll and Hydes t is one of those places that is fun to do once.",Jeckll and Hydes,positive
1457607:6_0,We had a good time.,NULL,positive
1459569:0_0,Went there with my wife and we had to wait for a table even though you could see there many that were empty with not reservation sigh on them.,NULL,negative
1459569:1_0,Service was slow had to wait to order and get food although not crowded.,Service,negative
1459569:2_0,Drinks way over priced.,Drinks,negative
1459569:3_0,Food was good not great not worth the wait or another visit,Food,neutral
1459569:3_1,Food was good not great not worth the wait or another visit,NULL,negative
1460715:0_0,Great pizza for lunch place.,pizza,positive
1460715:1_0,Service was quick.,Service,positive
1460715:2_0,The pizza was great.,pizza,positive
1460715:3_0,And it was quick which is very important.,NULL,positive
1460715:5_0,It was wonderful.,NULL,positive
1470286:0_0,"Whenever you need a Sushi fix, Mizu will be there with quality fish and great service.",fish,positive
1470286:0_1,"Whenever you need a Sushi fix, Mizu will be there with quality fish and great service.",service,positive
1470286:1_0,Delivery is fast too.,Delivery,positive
1470286:2_0,"Great friendly service, Fast seating, Fast Delivery, Excellent sushi.",service,positive
1470286:2_1,"Great friendly service, Fast seating, Fast Delivery, Excellent sushi.",seating,positive
1470286:2_2,"Great friendly service, Fast seating, Fast Delivery, Excellent sushi.",Delivery,positive
1470286:2_3,"Great friendly service, Fast seating, Fast Delivery, Excellent sushi.",sushi,positive
1470334:1_0,Ess-A-Bagel (either by Sty-town or midtown) is by far the best bagel in NY.,bagel,positive
1470334:2_0,"The bagels always warm, soft on the inside, crispy on the outside and enormous in size.",bagels,positive
1470334:2_1,"The bagels always warm, soft on the inside, crispy on the outside and enormous in size.",bagels,positive
1470334:3_0,They have a huge selection of different cream cheeses and all of their salads are great.,salads,positive
1470334:3_1,They have a huge selection of different cream cheeses and all of their salads are great.,cream cheeses,positive
1470334:4_0,The lox is always fresh too.,lox,positive
1470334:5_0,Highly recommended to all!,NULL,positive
1471273:2_0,Not impressed with the food.,food,negative
1471273:3_0,Prices too high for this cramped and unappealing resturant.,resturant,negative
1471273:3_1,Prices too high for this cramped and unappealing resturant.,resturant,negative
1471273:4_0,Zero ambiance to boot.,ambiance,negative
1476493:0_0,I thought this place was totally overrated.,place,negative
1476493:1_0,Everything we had was good or ok....but definitely nothing great.,NULL,neutral
1476493:2_0,"The ambience was nice, but service wasn't so great.",ambience,positive
1476493:2_1,"The ambience was nice, but service wasn't so great.",service,negative
1476493:3_0,"When you add it all together, it just doesn't seem worth it to me...especially considering the prices.",NULL,negative
1476493:3_1,"When you add it all together, it just doesn't seem worth it to me...especially considering the prices.",NULL,negative
1477631:0_0,This is the BEST Shabu-Shabu Restaurant in the Try-State Area.,Shabu-Shabu Restaurant,positive
1477631:1_0,I have lived in Japan for 7 years and the taste of the food and the feel of the restaurant is like being back in Japan.,food,positive
1477631:1_1,I have lived in Japan for 7 years and the taste of the food and the feel of the restaurant is like being back in Japan.,feel,positive
1477631:2_0,Thius is a must for anyone who loves Shabu-Shabu.,Shabu-Shabu,positive
1486041:0_0,"The atmosphere is nothing special, but it feels like a Sushi establishment in Tokyo.",atmosphere,positive
1486041:1_0,The owner and staff are all Japanese as well and that adds to the entire ambiance.,owner,positive
1486041:1_1,The owner and staff are all Japanese as well and that adds to the entire ambiance.,staff,positive
1486041:1_2,The owner and staff are all Japanese as well and that adds to the entire ambiance.,ambiance,positive
1486041:2_0,"Despite a slightly limited menu, everything prepared is done to perfection, ultra fresh and a work of food art.",menu,negative
1486041:2_1,"Despite a slightly limited menu, everything prepared is done to perfection, ultra fresh and a work of food art.",NULL,positive
1486041:2_2,"Despite a slightly limited menu, everything prepared is done to perfection, ultra fresh and a work of food art.",NULL,positive
1486041:3_0,I must give it Yon out of Yon stars!,NULL,positive
1486041:4_0,Taxan delicious!,Taxan,positive
1490757:1_0,We weren't!,NULL,positive
1490757:2_0,The prices were CHEAP compared to the quality of service and food.,NULL,positive
1490757:2_1,The prices were CHEAP compared to the quality of service and food.,service,positive
1490757:2_2,The prices were CHEAP compared to the quality of service and food.,food,positive
1490757:3_0,"We liked it so much, that we will always make it a point to dine here when we visit New York.",NULL,positive
1496205:1_0,The location and ambience is Ok but the food is what makes up for it.,location,neutral
1496205:1_1,The location and ambience is Ok but the food is what makes up for it.,ambience,neutral
1496205:1_2,The location and ambience is Ok but the food is what makes up for it.,food,positive
1496205:2_0,There is a lot of variety even for people who eat vegetarian like me.,NULL,positive
1496205:3_0,Try green curry with vegetables.,green curry with vegetables,positive
1496205:4_0,"The quantity is also very good, you will come out satisfied.",quantity,positive
1496205:5_0,"The service is ok, some of the people didn't get what they asked for.",service,neutral
1496707:0_0,I was there on sat. for my birthday and we had an excellent time.,NULL,positive
1496707:1_0,I had the best ravioli ever.,ravioli,positive
1496707:2_0,The wine the service was very good too.,wine,positive
1496707:2_1,The wine the service was very good too.,service,positive
1496707:3_0,Moderate prices.,NULL,neutral
1496707:4_0,A little noise but I think that was because of our party!,NULL,neutral
1500453:1_0,This quaint and romantic trattoria is at the top of my Manhattan restaurant list.,trattoria,positive
1500453:1_1,This quaint and romantic trattoria is at the top of my Manhattan restaurant list.,trattoria,positive
1500453:2_0,"The food is delicious - from the specials to the regular menu-fare, the dishes are never a disappointment.",food,positive
1500453:2_1,"The food is delicious - from the specials to the regular menu-fare, the dishes are never a disappointment.",dishes,positive
1500453:2_2,"The food is delicious - from the specials to the regular menu-fare, the dishes are never a disappointment.",specials,positive
1500453:2_3,"The food is delicious - from the specials to the regular menu-fare, the dishes are never a disappointment.",regular menu-fare,positive
1500453:3_0,"Whether it's the parmesean porcini souffle or the lamb glazed with balsamic vinegar, you will surely be transported to Northern Italy with one bite.",parmesean porcini souffle,positive
1500453:3_1,"Whether it's the parmesean porcini souffle or the lamb glazed with balsamic vinegar, you will surely be transported to Northern Italy with one bite.",lamb glazed with balsamic vinegar,positive
1500453:4_0,"Although the tables may be closely situated, the candle-light, food-quality and service overcompensate.",candle-light,positive
1500453:4_1,"Although the tables may be closely situated, the candle-light, food-quality and service overcompensate.",food,positive
1500453:4_2,"Although the tables may be closely situated, the candle-light, food-quality and service overcompensate.",service,positive
1500453:4_3,"Although the tables may be closely situated, the candle-light, food-quality and service overcompensate.",tables,negative
1500453:5_0,A guaranteeed delight!,NULL,positive
1506491:0_0,"I have known about this secret for the last 13 years, Emilio(the Godfather) has continued to serve food and wine for the gods at mortal prices.",food,positive
1506491:0_1,"I have known about this secret for the last 13 years, Emilio(the Godfather) has continued to serve food and wine for the gods at mortal prices.",wine,positive
1506491:0_2,"I have known about this secret for the last 13 years, Emilio(the Godfather) has continued to serve food and wine for the gods at mortal prices.",food,positive
1506491:0_3,"I have known about this secret for the last 13 years, Emilio(the Godfather) has continued to serve food and wine for the gods at mortal prices.",wine,positive
1506491:1_0,"If you go, try the marinara/arrabiatta sauce, the mozzarella en Carozza is mmmmmmmm..... everything is just delicious.",marinara/arrabiatta sauce,positive
1506491:1_1,"If you go, try the marinara/arrabiatta sauce, the mozzarella en Carozza is mmmmmmmm..... everything is just delicious.",mozzarella en Carozza,positive
1506491:1_2,"If you go, try the marinara/arrabiatta sauce, the mozzarella en Carozza is mmmmmmmm..... everything is just delicious.",NULL,positive
1506491:2_0,Check out the secret back room.,back room,positive
1506491:4_0,I pray it stays open forever.,NULL,positive
1506491:5_0,Thank You Emilio.,Emilio,positive
1538149:0_0,"I found the food, service and value exceptional everytime I have been there.",food,positive
1538149:0_1,"I found the food, service and value exceptional everytime I have been there.",service,positive
1538149:0_2,"I found the food, service and value exceptional everytime I have been there.",NULL,positive
1538149:1_0,The food was authentic.,food,positive
1538149:2_0,I felt as though I were eating in Paris.,NULL,positive
1538149:3_0,The service was excellent - friendly and attentive.,service,positive
1538149:4_0,The prices are wonderfully low.,NULL,positive
1538149:5_0,Very good wine choices.,wine choices,positive
1543345:1_0,Who has room for Cheesesticks with the best pizza in NYC!,pizza,positive
1543345:2_0,Get the pepperoni - YUM - and a family style salad.,pepperoni,positive
1543345:2_1,Get the pepperoni - YUM - and a family style salad.,family style salad,positive
1543345:3_0,Great staff.,staff,positive
1543345:4_0,Always great service!,service,positive
1543345:5_0,I go twice a month!,NULL,positive
1543345:6_0,Fantastic!,NULL,positive
1561259:0_0,"The food is good, I can't lie.",food,positive
1561259:1_0,But the staff was so horrible to us.,staff,negative
1561259:2_0,The hostess and the waitress were incredibly rude and did everything they could to rush us out.,hostess,negative
1561259:2_1,The hostess and the waitress were incredibly rude and did everything they could to rush us out.,waitress,negative
1561259:3_0,We were planning to get dessert but the waitress basically through the bill at us before we had a chance to order.,waitress,negative
1561259:4_0,"This place is pricey, and yes, the food is worth it; but the service makes you feel like you should be paying a quater of the price.",place,negative
1561259:4_1,"This place is pricey, and yes, the food is worth it; but the service makes you feel like you should be paying a quater of the price.",food,positive
1561259:4_2,"This place is pricey, and yes, the food is worth it; but the service makes you feel like you should be paying a quater of the price.",service,negative
1561259:5_0,Save yourself the time and trouble and skip this one!,NULL,negative
1572027:1_0,Amma is nothing special.,Amma,neutral
1572027:3_0,I ate here a week ago and found most dishes average at best and too expensive.,dishes,negative
1572027:3_1,I ate here a week ago and found most dishes average at best and too expensive.,dishes,negative
1572027:4_0,Will not be back.,NULL,negative
1572033:0_0,"Don't dine at Tamarind for the vegetarian dishes, they are simply not up to par with the non-veg selections.",vegetarian dishes,negative
1572033:0_1,"Don't dine at Tamarind for the vegetarian dishes, they are simply not up to par with the non-veg selections.",non-veg selections,positive
1572033:1_0,Decor is nice though service can be spotty.,Decor,positive
1572033:1_1,Decor is nice though service can be spotty.,service,negative
1572033:2_0,This place is always packed.,place,neutral
1572033:4_0,"Most importantly, food is excellent.",food,positive
1572033:5_0,Try the sea bass.,sea bass,positive
1572033:6_0,Highly recommended.,NULL,positive
1573534:0_0,First of all Dal Bukhara Rocks.,Dal Bukhara,positive
1573534:3_0,I am happy i did the food was awsome.,food,positive
1573534:4_0,JUST AWSOME.,NULL,positive
1573534:5_0,and yes Dal Bukhara is so dam good and so are all the kababs.,kababs,positive
1573534:5_1,and yes Dal Bukhara is so dam good and so are all the kababs.,Dal Bukhara,positive
1573534:7_0,but overall i give it a 10,NULL,positive
1573534:8_0,10,NULL,positive
1577714:1_0,Haru on Park S is simply disgusting.,Haru on Park S,negative
1577714:2_0,The fish was not fresh and the rice tasted old and stale.,fish,negative
1577714:2_1,The fish was not fresh and the rice tasted old and stale.,rice,negative
1577714:3_0,"Quite frankly, this is some of the worst sushi I have ever tried.",sushi,negative
1577714:4_0,Will never be back.,NULL,negative
1586174:0_0,honestly the worst sushi my husband and i had in our entire lives.,sushi,negative
1586174:2_0,not sure why this restaurant would be rated that highly.,restaurant,negative
1586174:3_0,the all-u-can-eat sushi is definitely in very poor quality.,all-u-can-eat sushi,negative
1586174:4_0,"limited menu, no-so-fresh ingredients, thinly-sliced fish, fall-apart rice. ",menu,negative
